<?xml version="1.0" encoding="UTF-8"?>
<xs:schema xmlns:xs="http://www.w3.org/2001/XMLSchema" elementFormDefault="qualified" attributeFormDefault="unqualified">
	<xs:element name="Titles">
		<xs:complexType>
			<xs:choice minOccurs="0" maxOccurs="unbounded">
				<xs:element name="title">
					<xs:complexType>
						<xs:choice minOccurs="0" maxOccurs="unbounded">
							<xs:element name="subTitle">
								<xs:complexType>
									<xs:attributeGroup ref="t2"/>
								</xs:complexType>
							</xs:element>
						</xs:choice>
						<xs:attributeGroup ref="t1"/>
					</xs:complexType>
				</xs:element>
			</xs:choice>
		</xs:complexType>
	</xs:element>
	<xs:attributeGroup name="t1">
		<xs:attribute name="id" use="required">
			<xs:simpleType>
				<xs:restriction base="xs:int">
					<xs:minInclusive value="1000"/>
					<xs:maxInclusive value="9999"/>
				</xs:restriction>
			</xs:simpleType>
		</xs:attribute>
		<xs:attribute name="name" use="required" type="xs:string"/>
	</xs:attributeGroup>
	<xs:attributeGroup name="t2">
		<xs:attribute name="id" use="required">
			<xs:simpleType>
				<xs:restriction base="xs:int">
					<xs:minInclusive value="01"/>
					<xs:maxInclusive value="99"/>
				</xs:restriction>
			</xs:simpleType>
		</xs:attribute>
		<xs:attribute name="name" use="required" type="xs:string"/>
	</xs:attributeGroup>
</xs:schema>
